{
  "kind": "sketchup-live-extraction-output",
  "contractVersion": "1.0.0",
  "requestId": "sketchup-poc-action-demo124",
  "action": "extract-model-snapshot",
  "executionState": "failed-not-implemented",
  "sourceKind": "preflight-only",
  "readOnly": true,
  "generatedAtUtc": "2026-04-06T00:10:05Z",
  "preflight": {
    "status": "blocked",
    "bootstrapActionable": true,
    "trueLiveExtractionReady": false,
    "blockerCodes": [
      "bootstrap-path-blocked"
    ]
  },
  "bootstrap": {
    "strategyKey": "ruby-startup-open-document",
    "ready": true,
    "invocation": {
      "executablePath": "C:\\Program Files\\SketchUp\\SketchUp 2025\\SketchUp.exe",
      "attachMode": "launch-or-reuse",
      "startupMode": "ruby-startup",
      "launchArguments": [
        "-RubyStartup",
        "C:\\OpenClaw\\SketchUpPoC\\bootstrap\\sketchup-poc-action-demo124.bootstrap.rb",
        "C:\\Projects\\office-demo.skp"
      ],
      "commandPreview": "C:\\Program Files\\SketchUp\\SketchUp 2025\\SketchUp.exe -RubyStartup C:\\OpenClaw\\SketchUpPoC\\bootstrap\\sketchup-poc-action-demo124.bootstrap.rb C:\\Projects\\office-demo.skp"
    },
    "artifacts": {
      "bootstrapDirectory": "C:\\OpenClaw\\SketchUpPoC\\bootstrap",
      "manifestPath": "C:\\OpenClaw\\SketchUpPoC\\bootstrap\\sketchup-poc-action-demo124.bootstrap-plan.json",
      "rubyScriptPath": "C:\\OpenClaw\\SketchUpPoC\\bootstrap\\sketchup-poc-action-demo124.bootstrap.rb",
      "contextPath": "C:\\OpenClaw\\SketchUpPoC\\bootstrap\\sketchup-poc-action-demo124.bootstrap-context.json",
      "bootstrapStatusPath": "C:\\OpenClaw\\SketchUpPoC\\bootstrap\\sketchup-poc-action-demo124.bootstrap-status.json"
    }
  },
  "safeQueryProof": {
    "queryKind": "model-bounds-summary",
    "sourceKind": "bootstrap-live-safe-query",
    "readOnly": true,
    "available": false,
    "status": "unavailable",
    "value": null,
    "unavailableReason": "no-live-model-proof"
  },
  "snapshot": null,
  "validation": {
    "attempted": false,
    "valid": null,
    "validator": null
  },
  "statsAvailable": false,
  "stats": null,
  "warnings": [
    "This artifact records extractor execution/preflight state only.",
    "No live SketchUp snapshot has been emitted yet."
  ]
}
